{
  "schemaVersion": "jlink-mcp.test-catalog/v1",
  "specVersion": "0.2.1",
  "generatedAt": "2026-07-14T00:00:00Z",
  "tests": [
    {
      "id": "TEST-REQ-GEN-001",
      "kind": "contract",
      "level": "release",
      "description": "生产代码在不依赖 HM_C095、FOC_SCM、固定目标 ID 或固定绝对路径的情况下可启动并完成能力发现。",
      "status": "planned",
      "evidence": [],
      "requirementId": "REQ-GEN-001",
      "ownerPhase": "P09"
    },
    {
      "id": "TEST-REQ-GEN-002",
      "kind": "contract",
      "level": "module",
      "description": "server instructions、resources 和 prompts 不宣称 MCP 自动理解业务或生成项目语义结论。",
      "status": "planned",
      "evidence": [],
      "requirementId": "REQ-GEN-002",
      "ownerPhase": "P08"
    },
    {
      "id": "TEST-REQ-GEN-003",
      "kind": "contract",
      "level": "module",
      "description": "核心工具返回统一 envelope，包含 operation、risk、backend、artifacts、warnings 和结果状态。",
      "status": "planned",
      "evidence": [],
      "requirementId": "REQ-GEN-003",
      "ownerPhase": "P01"
    },
    {
      "id": "TEST-REQ-GEN-004",
      "kind": "contract",
      "level": "module",
      "description": "静态检查和集成测试证明运行时 project context 不调用 Git。",
      "status": "planned",
      "evidence": [],
      "requirementId": "REQ-GEN-004",
      "ownerPhase": "P01"
    },
    {
      "id": "TEST-REQ-GEN-005",
      "kind": "integration",
      "level": "release",
      "description": "硬件验收前后目标源码 fingerprint 一致，sourceModified=false。",
      "status": "planned",
      "evidence": [],
      "requirementId": "REQ-GEN-005",
      "ownerPhase": "P09"
    },
    {
      "id": "TEST-REQ-ROLE-001",
      "kind": "contract",
      "level": "module",
      "description": "Agent workflow 文档明确 MCP 只提供能力与证据，Agent 负责决策。",
      "status": "planned",
      "evidence": [],
      "requirementId": "REQ-ROLE-001",
      "ownerPhase": "P08"
    },
    {
      "id": "TEST-REQ-ROLE-002",
      "kind": "contract",
      "level": "module",
      "description": "mcu_capabilities 和 mcu_tool_catalog 能枚举公共能力及其风险。",
      "status": "planned",
      "evidence": [],
      "requirementId": "REQ-ROLE-002",
      "ownerPhase": "P08"
    },
    {
      "id": "TEST-REQ-ROLE-003",
      "kind": "integration",
      "level": "phase",
      "description": "R4 execute 无可信 approval receipt 时稳定拒绝。",
      "status": "planned",
      "evidence": [],
      "requirementId": "REQ-ROLE-003",
      "ownerPhase": "P07"
    },
    {
      "id": "TEST-REQ-PATH-001",
      "kind": "integration",
      "level": "module",
      "description": "在不同 cwd 启动时 projectRoot 精确等于对应规范化 cwd。",
      "status": "planned",
      "evidence": [],
      "requirementId": "REQ-PATH-001",
      "ownerPhase": "P01"
    },
    {
      "id": "TEST-REQ-PATH-002",
      "kind": "contract",
      "level": "module",
      "description": "无 Git 环境测试通过，且静态检查未发现运行时 Git root 探测。",
      "status": "planned",
      "evidence": [],
      "requirementId": "REQ-PATH-002",
      "ownerPhase": "P01"
    },
    {
      "id": "TEST-REQ-PATH-003",
      "kind": "contract",
      "level": "module",
      "description": "公共 tool schema 中不存在必填 projectRoot 参数；project context 来自 server cwd。",
      "status": "planned",
      "evidence": [],
      "requirementId": "REQ-PATH-003",
      "ownerPhase": "P01"
    },
    {
      "id": "TEST-REQ-PATH-004",
      "kind": "integration",
      "level": "module",
      "description": "初始化后只在 cwd 下创建 `.jlink-mcp` 及规定子目录。",
      "status": "planned",
      "evidence": [],
      "requirementId": "REQ-PATH-004",
      "ownerPhase": "P01"
    },
    {
      "id": "TEST-REQ-PATH-005",
      "kind": "unit",
      "level": "phase",
      "description": "Windows 路径、大小写、UNC、符号链接/junction 和 TOCTOU 相关边界测试通过。",
      "status": "planned",
      "evidence": [],
      "requirementId": "REQ-PATH-005",
      "ownerPhase": "P01"
    },
    {
      "id": "TEST-REQ-PATH-006",
      "kind": "contract",
      "level": "module",
      "description": "显式 sessionName 被规范化保存；缺省时生成符合命名规则的唯一名称。",
      "status": "planned",
      "evidence": [],
      "requirementId": "REQ-PATH-006",
      "ownerPhase": "P01"
    },
    {
      "id": "TEST-REQ-PATH-007",
      "kind": "unit",
      "level": "module",
      "description": "cwd 内合法子目录通过；cwd 外、链接逃逸和路径歧义被拒绝。",
      "status": "planned",
      "evidence": [],
      "requirementId": "REQ-PATH-007",
      "ownerPhase": "P01"
    },
    {
      "id": "TEST-REQ-ART-001",
      "kind": "unit",
      "level": "module",
      "description": "ELF 内容配合不同扩展名均被识别；伪造扩展名但非 ELF 内容被拒绝。",
      "status": "planned",
      "evidence": [],
      "requirementId": "REQ-ART-001",
      "ownerPhase": "P02"
    },
    {
      "id": "TEST-REQ-ART-002",
      "kind": "integration",
      "level": "module",
      "description": "含 DWARF 的 fixture 可解析地址、类型和 struct member offset。",
      "status": "planned",
      "evidence": [],
      "requirementId": "REQ-ART-002",
      "ownerPhase": "P02"
    },
    {
      "id": "TEST-REQ-ART-003",
      "kind": "unit",
      "level": "module",
      "description": "IAR map fixture 可解析唯一 global/static symbol；重复或缺失符号产生结构化错误。",
      "status": "planned",
      "evidence": [],
      "requirementId": "REQ-ART-003",
      "ownerPhase": "P02"
    },
    {
      "id": "TEST-REQ-ART-004",
      "kind": "contract",
      "level": "module",
      "description": "将这些文件传给 symbol/artifact resolver 时稳定返回 unsupported，而 Flash probe 可接受。",
      "status": "planned",
      "evidence": [],
      "requirementId": "REQ-ART-004",
      "ownerPhase": "P02"
    },
    {
      "id": "TEST-REQ-ART-005",
      "kind": "integration",
      "level": "module",
      "description": "多候选 fixture 返回 selection-required 与候选列表；不自动选择最新 FOC_SCM 文件。",
      "status": "planned",
      "evidence": [],
      "requirementId": "REQ-ART-005",
      "ownerPhase": "P02"
    },
    {
      "id": "TEST-REQ-ART-006",
      "kind": "contract",
      "level": "module",
      "description": "artifact SHA-256 在 catalog、plan、capture metadata 和 phase evidence 中一致。",
      "status": "planned",
      "evidence": [],
      "requirementId": "REQ-ART-006",
      "ownerPhase": "P02"
    },
    {
      "id": "TEST-REQ-ART-007",
      "kind": "contract",
      "level": "module",
      "description": "生产源码静态检查无专用默认名；相关名称仅存在于 tests/fixtures、examples 或硬件 profile。",
      "status": "planned",
      "evidence": [],
      "requirementId": "REQ-ART-007",
      "ownerPhase": "P02"
    },
    {
      "id": "TEST-REQ-VREAD-001",
      "kind": "integration",
      "level": "module",
      "description": "离线解析和模拟 memory backend 返回正确类型和值。",
      "status": "planned",
      "evidence": [],
      "requirementId": "REQ-VREAD-001",
      "ownerPhase": "P03"
    },
    {
      "id": "TEST-REQ-VREAD-002",
      "kind": "integration",
      "level": "module",
      "description": "同名 static 未限定时返回歧义；限定后读取正确地址和值。",
      "status": "planned",
      "evidence": [],
      "requirementId": "REQ-VREAD-002",
      "ownerPhase": "P03"
    },
    {
      "id": "TEST-REQ-VREAD-003",
      "kind": "integration",
      "level": "module",
      "description": "member offset 来自 DWARF/受验证布局，读取值与 fixture 一致。",
      "status": "planned",
      "evidence": [],
      "requirementId": "REQ-VREAD-003",
      "ownerPhase": "P03"
    },
    {
      "id": "TEST-REQ-VREAD-004",
      "kind": "contract",
      "level": "module",
      "description": "local selector 返回明确 unsupported，不退化为地址猜测。",
      "status": "planned",
      "evidence": [],
      "requirementId": "REQ-VREAD-004",
      "ownerPhase": "P02"
    },
    {
      "id": "TEST-REQ-VREAD-005",
      "kind": "contract",
      "level": "module",
      "description": "含 `*`、`->` 或隐式指针遍历的 selector 被拒绝。",
      "status": "planned",
      "evidence": [],
      "requirementId": "REQ-VREAD-005",
      "ownerPhase": "P02"
    },
    {
      "id": "TEST-REQ-VREAD-006",
      "kind": "contract",
      "level": "module",
      "description": "动态对象 selector 返回 unsupported，且不进行 target memory chase。",
      "status": "planned",
      "evidence": [],
      "requirementId": "REQ-VREAD-006",
      "ownerPhase": "P02"
    },
    {
      "id": "TEST-REQ-VREAD-007",
      "kind": "contract",
      "level": "module",
      "description": "多镜像/多核输入返回 unsupported 或 selection-required，不默选 core/image。",
      "status": "planned",
      "evidence": [],
      "requirementId": "REQ-VREAD-007",
      "ownerPhase": "P02"
    },
    {
      "id": "TEST-REQ-VWRITE-001",
      "kind": "hardware",
      "level": "phase",
      "description": "允许目标通过 plan→execute→readback，非 RAM 目标被拒绝。",
      "status": "planned",
      "evidence": [],
      "requirementId": "REQ-VWRITE-001",
      "ownerPhase": "P04"
    },
    {
      "id": "TEST-REQ-VWRITE-002",
      "kind": "integration",
      "level": "module",
      "description": "member 地址由 catalog 解析，写后 readback 与目标值一致。",
      "status": "planned",
      "evidence": [],
      "requirementId": "REQ-VWRITE-002",
      "ownerPhase": "P04"
    },
    {
      "id": "TEST-REQ-VWRITE-003",
      "kind": "contract",
      "level": "module",
      "description": "execute 缺少有效 plan 时拒绝；plan 包含 target、类型、范围、risk、policy 和验证步骤。",
      "status": "planned",
      "evidence": [],
      "requirementId": "REQ-VWRITE-003",
      "ownerPhase": "P04"
    },
    {
      "id": "TEST-REQ-VWRITE-004",
      "kind": "hardware",
      "level": "phase",
      "description": "readback mismatch 返回失败/未知状态并写入 audit；不得报告成功。",
      "status": "planned",
      "evidence": [],
      "requirementId": "REQ-VWRITE-004",
      "ownerPhase": "P04"
    },
    {
      "id": "TEST-REQ-VWRITE-005",
      "kind": "contract",
      "level": "module",
      "description": "目标 A 超限后 A 被拒绝，目标 B 仍可按 policy 执行；session 不被整体关闭。",
      "status": "planned",
      "evidence": [],
      "requirementId": "REQ-VWRITE-005",
      "ownerPhase": "P04"
    },
    {
      "id": "TEST-REQ-VWRITE-006",
      "kind": "contract",
      "level": "module",
      "description": "dryRun 返回计划、旧值读取意图和验证步骤；目标值与写计数均不变。",
      "status": "planned",